<?xml version="1.0" encoding="UTF-8"?>
<generator xmlns="http://www.lifeonwalden.com/ddlGenerator" xmlns:xsi="http://www.w3.org/2001/XMLSchema-instance" xsi:schemaLocation="http://www.lifeonwalden.com/ddlGenerator schema/ddlGenerator.xsd">
	<config encoding="UTF-8">
		<constInfo packageName="com.orientsec.demo.consts" folderName="java" />
		<daoInfo packageName="com.orientsec.demo.dao" folderName="java" namePattern="?Mapper" />
		<beanInfo packageName="com.orientsec.demo.bean" folderName="java" generator="com.lifeonwalden.codeGenerator.javaClass.impl.HashBeanGeneratorImpl"
				  paramNamePattern="?Param" />
		<mybatisInfo namespace="com.orientsec.demo.dao" folderName="resources" />
	</config>
	<constPool>
		<enumConst name="Option" note="OptionEnum">
			<options>
				<valueEnum name="OPTION_001" value="1" alias="001" desc="description001" />
				<valueEnum name="OPTION_002" value="2" alias="002" desc="description002" />
			</options>
		</enumConst>
	</constPool>
	<database name="TestDB" schema="prd" note="test database" generator="com.lifeonwalden.codeGenerator.dll.impl.MSSQLTableGeneratorImpl">
		<dbFields>
			<column name="createTime" type="timestamp" required="true" defaultVal="CURRENT_TIMESTAMP" note="创建时间" />
			<column name="createUser" type="varchar" note="创建者" length="32" />
			<column name="updateTime" type="timestamp" required="true" defaultVal="CURRENT_TIMESTAMP" extra="ON UPDATE CURRENT_TIMESTAMP" note="更新时间" />
			<column name="updateUser" type="varchar" note="更新者" length="32" />
			<column name="logicalDel" type="int" note="逻辑删除" defaultVal="0" />
		</dbFields>
		<tables>
			<table name="TestTable" note="test table">
				<columns>
					<column name="testColumn001" type="varchar" length="20" required="true" defaultVal="hello world" note="note001" optionRef="OptionEnum" />
					<column name="testColumn002" type="int" required="false" defaultVal="hello world" note="note001">
						<options>
							<valueEnum name="OPTION_001" value="1" alias="001" desc="description" />
							<valueEnum name="OPTION_002" value="2" alias="002" desc="description002" />
						</options>
					</column>
				</columns>
				<extProps>
					<column name="name" type="varchar"></column>
				</extProps>
				<constraints>
					<constraint type="PRIMARY KEY" name="PK">
						<columns>
							<indexColumn name="testColumn001" order="DESC" />
						</columns>
					</constraint>
				</constraints>
				<indexs>
					<index name="TestTable_Index" type="UNIQUE">
						<columns>
							<indexColumn name="testColumn002" order="DESC" />
						</columns>
					</index>
				</indexs>
				<options>
					<option option="ENGINE" value="InnoDB" />
				</options>
			</table>

			<table name="TestTable02" note="test table" addDBFields="false">
				<columns>
					<column name="testColumn001" type="varchar" length="20" required="true" defaultVal="hello world" note="note001" optionRef="OptionEnum" />
					<column name="testColumn002" type="int" required="false" defaultVal="hello world" note="note001" />
				</columns>
			</table>
		</tables>
	</database>
</generator>